{
    "deploy": [
        "../deploy.md"
    ],
    "docs": "",
    "features": [
        "Dual-core",
        "External Flash",
        "RGB LED",
        "USB-C"
    ],
    "images": [
        "tiny-2040-on-white-1_1024x1024.jpg"
    ],
    "mcu": "rp2040",
    "product": "Tiny2040",
    "thumbnail": "",
    "url": "https://shop.pimoroni.com/products/tiny-2040",
    "variants": {
        "FLASH_8M": "8 MiB Flash"
    },
    "vendor": "Pimoroni"
}
