{
    "deploy": [
        "../deploy.md"
    ],
    "docs": "",
    "features": [
        "External Flash",
        "RGB LED",
        "USB"
    ],
    "images": [
        "itsybitsy_m0_express.jpg"
    ],
    "mcu": "samd21",
    "product": "ItsyBitsy M0 Express",
    "thumbnail": "",
    "url": "https://www.adafruit.com/product/3727",
    "vendor": "Adafruit"
}
