{
    "deploy": [
        "../deploy.md"
    ],
    "docs": "",
    "features": [],
    "images": [
        "PyMateIO_Core.jpg"
    ],
    "mcu": "stm32f4",
    "product": "GARATRONIC_PYMATE_CORE",
    "thumbnail": "",
    "url": "https://www.pymate.io/product/pymateio-core-8-digital-analog-inputs-8-digital-outputs-rs485-port-can-port/",
    "vendor": "PyMateIO"
}
