{
    "deploy": [
        "../deploy.md"
    ],
    "deploy_options": {
        "flash_offset": "0x1000"
    },
    "docs": "",
    "features": [
        "BLE",
        "Ethernet",
        "External Flash",
        "PoE",
        "WiFi"
    ],
    "images": [
        "wesp32-iso.jpg",
        "wesp32-top.jpg"
    ],
    "mcu": "esp32",
    "product": "SIL WESP32",
    "thumbnail": "",
    "url": "https://wesp32.com/",
    "vendor": "Silicognition"
}
