{
    "deploy": [
        "./deploy_flashmode.md",
        "../deploy_nativeusb.md"
    ],
    "deploy_options": {
        "flash_offset": "0"
    },
    "docs": "",
    "features": [
        "Battery Charging",
        "RGB LED",
        "External RAM",
        "WiFi",
        "BLE"
    ],
    "features_non_filterable": [
        "I2C BAT Fuel Gauge"
    ],
    "images": [
        "unexpectedmaker_omgs3.jpg"
    ],
    "mcu": "esp32s3",
    "product": "OMGS3",
    "thumbnail": "",
    "url": "https://omgs3.io",
    "vendor": "Unexpected Maker"
}
