{
    "deploy": [
        "../deploy.md"
    ],
    "docs": "",
    "features": [],
    "images": [
        "BL652-SA_JPG-500.jpg"
    ],
    "mcu": "nrf52",
    "product": "DVK-BL652",
    "thumbnail": "",
    "url": "https://www.ezurio.com/wireless-modules/bluetooth-modules/bluetooth-5-modules/bl652-series-bluetooth-v5-nfc-module",
    "vendor": "Ezurio"
}
