{
    "deploy": [
        "../deploy.md"
    ],
    "docs": "",
    "features": [],
    "images": [
        "nucleo_g474re.jpg"
    ],
    "mcu": "stm32g4",
    "product": "Nucleo G474RE",
    "thumbnail": "",
    "url": "https://www.st.com/en/evaluation-tools/nucleo-g474re.html",
    "vendor": "ST Microelectronics"
}
