{
    "deploy": [
        "../deploy.md"
    ],
    "docs": "",
    "features": [],
    "images": [
        "blyst-nano-mod-4_jpg_project-body.jpg"
    ],
    "mcu": "nrf52",
    "product": "BLUEIO Tag EVIM",
    "thumbnail": "",
    "url": "https://www.i-syst.com/index.php/products/blyst-nano",
    "vendor": "I-SYST"
}
