{
    "deploy": [
        "../deploy.md"
    ],
    "docs": "",
    "features": [
        "Dual-core",
        "Ethernet",
        "External Flash",
        "USB"
    ],
    "images": [
        "W6100-EVB-Pico2.jpg"
    ],
    "mcu": "rp2350",
    "product": "W6100-EVB-Pico2",
    "thumbnail": "",
    "url": "https://docs.wiznet.io/Product/iEthernet/W6100/w6100-evb-pico2",
    "vendor": "WIZnet"
}
