{
    "deploy": [
        "../deploy.md"
    ],
    "docs": "",
    "features": [
        "BLE",
        "Battery Charging",
        "Dual-core",
        "External Flash",
        "External RAM",
        "Feather",
        "JST-SH",
        "RGB LED",
        "USB-C",
        "WiFi",
        "microSD"
    ],
    "images": [
        "25134-Thing-Plus-RP2350-Feature.jpg"
    ],
    "mcu": "rp2350",
    "product": "Thing Plus RP2350",
    "thumbnail": "",
    "url": "https://www.sparkfun.com/products/25134",
    "vendor": "Sparkfun"
}
